{"format":"drill-diagram","version":1,"title":"Half court, landscape","view":"half","side":"bottom","orient":"landscape","items":[
{"type":"zone","x":0,"y":29,"w":10,"h":3,"label":"Transition"},
{"type":"player","x":7,"y":41,"label":"A","team":"orange"},{"type":"player","x":13,"y":28.5,"label":"F","team":"black"},
{"type":"move","x1":7,"y1":39.5,"x2":7,"y2":31.5},
{"type":"ball","x1":13,"y1":27.5,"x2":7.5,"y2":40,"curve":true,"bend":-1,"n":1},
{"type":"cone","x":3,"y":36}]}
